{
  "$schema": "./pushdown-superset.schema.json",
  "probe": "D-06",
  "status": "pass",
  "recorded_at": "2026-09-01T08:03:09Z",
  "duration_s": 5,
  "binary": {
    "path": "/Applications/Caido.app/Contents/Resources/bin/caido-cli",
    "expected_version": "0.58.2",
    "reported_version": "0.58.2",
    "sha256": "b764e0094f0f97d28591f6d58d648fecb225b4446e3ffb7ea49bca030138e932"
  },
  "host": {
    "os": "darwin",
    "release": "25.6.0",
    "arch": "arm64",
    "cores": 14
  },
  "instances": [
    {
      "run_id": "20260901T080305Z-7678",
      "listen": "127.0.0.1:8963",
      "probe_zip_sha256": "5ffbaf8ff5dd47240112feda337dcb3a6c3cf5ba4e12d286062ff983e136f0a2"
    }
  ],
  "method": "A fresh, version-asserted Caido on an isolated data path with a temporary project. The generated fixture corpus is served by scripts/spike/origin.py from a per-path sidecar and proxied through the instance once. A disposable backend plugin then calls sdk.requests.matches(clause, request, response) \u2014 synchronous and in-process \u2014 for every stored pair, so the proof costs one capture pass and not one round trip per case. The probe records the evaluator's answers and makes no classification decision of its own; the shipped isScriptish is applied in tests/phase6-pushdown.spec.ts and joined to these rows by fixture id.",
  "clause": {
    "value": "(req.path.like:\"%.js%\" OR req.path.like:\"%.mjs%\" OR resp.raw.like:\"%javascript%\" OR resp.raw.like:\"%ecmascript%\" OR resp.raw.like:\"%jscript%\" OR resp.raw.like:\"%livescript%\" OR resp.raw.like:\"%text/js%\") AND resp.code.gte:200 AND resp.code.lt:300",
    "route": "node-type-stripping",
    "echoed_by_probe": "(req.path.like:\"%.js%\" OR req.path.like:\"%.mjs%\" OR resp.raw.like:\"%javascript%\" OR resp.raw.like:\"%ecmascript%\" OR resp.raw.like:\"%jscript%\" OR resp.raw.like:\"%livescript%\" OR resp.raw.like:\"%text/js%\") AND resp.code.gte:200 AND resp.code.lt:300"
  },
  "fixtures": [
    {
      "fixture_id": "path-js-markup-content-type",
      "request_path": "/f01-suffix.js",
      "request_url": "http://127.0.0.1:8964/f01-suffix.js",
      "request_id": "1",
      "response_status": 200,
      "response_content_type": "text/html",
      "clause_matched": true,
      "expected": "accepted",
      "media_type_exercised": null
    },
    {
      "fixture_id": "path-uppercase-js-opaque-content-type",
      "request_path": "/F02-UPPER.JS",
      "request_url": "http://127.0.0.1:8964/F02-UPPER.JS",
      "request_id": "2",
      "response_status": 200,
      "response_content_type": "application/octet-stream",
      "clause_matched": true,
      "expected": "accepted",
      "media_type_exercised": null
    },
    {
      "fixture_id": "path-mjs-module-suffix",
      "request_path": "/f03-module.mjs",
      "request_url": "http://127.0.0.1:8964/f03-module.mjs",
      "request_id": "3",
      "response_status": 200,
      "response_content_type": "application/octet-stream",
      "clause_matched": true,
      "expected": "accepted",
      "media_type_exercised": null
    },
    {
      "fixture_id": "no-extension-scriptish-content-type",
      "request_path": "/f04-noext",
      "request_url": "http://127.0.0.1:8964/f04-noext",
      "request_id": "4",
      "response_status": 200,
      "response_content_type": "application/javascript",
      "clause_matched": true,
      "expected": "accepted",
      "media_type_exercised": null
    },
    {
      "fixture_id": "path-js-with-query-string",
      "request_path": "/f05-query.js",
      "request_url": "http://127.0.0.1:8964/f05-query.js?v=2",
      "request_id": "5",
      "response_status": 200,
      "response_content_type": "application/octet-stream",
      "clause_matched": true,
      "expected": "accepted",
      "media_type_exercised": null
    },
    {
      "fixture_id": "path-js-with-fragment",
      "request_path": "/f06-frag.js",
      "request_url": "http://127.0.0.1:8964/f06-frag.js",
      "request_id": "6",
      "response_status": 200,
      "response_content_type": "application/octet-stream",
      "clause_matched": true,
      "expected": "accepted",
      "media_type_exercised": null
    },
    {
      "fixture_id": "content-type-with-charset-parameter",
      "request_path": "/f07-charset.bin",
      "request_url": "http://127.0.0.1:8964/f07-charset.bin",
      "request_id": "7",
      "response_status": 200,
      "response_content_type": "text/javascript; charset=utf-8",
      "clause_matched": true,
      "expected": "accepted",
      "media_type_exercised": null
    },
    {
      "fixture_id": "content-type-uppercase",
      "request_path": "/f08-upperct.bin",
      "request_url": "http://127.0.0.1:8964/f08-upperct.bin",
      "request_id": "8",
      "response_status": 200,
      "response_content_type": "TEXT/JAVASCRIPT",
      "clause_matched": true,
      "expected": "accepted",
      "media_type_exercised": null
    },
    {
      "fixture_id": "javascript-body-served-text-plain",
      "request_path": "/f09-plain.txt",
      "request_url": "http://127.0.0.1:8964/f09-plain.txt",
      "request_id": "9",
      "response_status": 200,
      "response_content_type": "text/plain",
      "clause_matched": true,
      "expected": "rejected",
      "media_type_exercised": null
    },
    {
      "fixture_id": "markup-page-with-script-element",
      "request_path": "/f10-markup.html",
      "request_url": "http://127.0.0.1:8964/f10-markup.html",
      "request_id": "10",
      "response_status": 200,
      "response_content_type": "text/html",
      "clause_matched": false,
      "expected": "rejected",
      "media_type_exercised": null
    },
    {
      "fixture_id": "media-application-ecmascript",
      "request_path": "/m01.bin",
      "request_url": "http://127.0.0.1:8964/m01.bin",
      "request_id": "11",
      "response_status": 200,
      "response_content_type": "application/ecmascript",
      "clause_matched": true,
      "expected": "accepted",
      "media_type_exercised": "application/ecmascript"
    },
    {
      "fixture_id": "media-application-javascript",
      "request_path": "/m02.bin",
      "request_url": "http://127.0.0.1:8964/m02.bin",
      "request_id": "12",
      "response_status": 200,
      "response_content_type": "application/javascript",
      "clause_matched": true,
      "expected": "accepted",
      "media_type_exercised": "application/javascript"
    },
    {
      "fixture_id": "media-application-x-ecmascript",
      "request_path": "/m03.bin",
      "request_url": "http://127.0.0.1:8964/m03.bin",
      "request_id": "13",
      "response_status": 200,
      "response_content_type": "application/x-ecmascript",
      "clause_matched": true,
      "expected": "accepted",
      "media_type_exercised": "application/x-ecmascript"
    },
    {
      "fixture_id": "media-application-x-javascript",
      "request_path": "/m04.bin",
      "request_url": "http://127.0.0.1:8964/m04.bin",
      "request_id": "14",
      "response_status": 200,
      "response_content_type": "application/x-javascript",
      "clause_matched": true,
      "expected": "accepted",
      "media_type_exercised": "application/x-javascript"
    },
    {
      "fixture_id": "media-text-ecmascript",
      "request_path": "/m05.bin",
      "request_url": "http://127.0.0.1:8964/m05.bin",
      "request_id": "15",
      "response_status": 200,
      "response_content_type": "text/ecmascript",
      "clause_matched": true,
      "expected": "accepted",
      "media_type_exercised": "text/ecmascript"
    },
    {
      "fixture_id": "media-text-javascript",
      "request_path": "/m06.bin",
      "request_url": "http://127.0.0.1:8964/m06.bin",
      "request_id": "16",
      "response_status": 200,
      "response_content_type": "text/javascript",
      "clause_matched": true,
      "expected": "accepted",
      "media_type_exercised": "text/javascript"
    },
    {
      "fixture_id": "media-text-javascript1-0",
      "request_path": "/m07.bin",
      "request_url": "http://127.0.0.1:8964/m07.bin",
      "request_id": "17",
      "response_status": 200,
      "response_content_type": "text/javascript1.0",
      "clause_matched": true,
      "expected": "accepted",
      "media_type_exercised": "text/javascript1.0"
    },
    {
      "fixture_id": "media-text-javascript1-1",
      "request_path": "/m08.bin",
      "request_url": "http://127.0.0.1:8964/m08.bin",
      "request_id": "18",
      "response_status": 200,
      "response_content_type": "text/javascript1.1",
      "clause_matched": true,
      "expected": "accepted",
      "media_type_exercised": "text/javascript1.1"
    },
    {
      "fixture_id": "media-text-javascript1-2",
      "request_path": "/m09.bin",
      "request_url": "http://127.0.0.1:8964/m09.bin",
      "request_id": "19",
      "response_status": 200,
      "response_content_type": "text/javascript1.2",
      "clause_matched": true,
      "expected": "accepted",
      "media_type_exercised": "text/javascript1.2"
    },
    {
      "fixture_id": "media-text-javascript1-3",
      "request_path": "/m10.bin",
      "request_url": "http://127.0.0.1:8964/m10.bin",
      "request_id": "20",
      "response_status": 200,
      "response_content_type": "text/javascript1.3",
      "clause_matched": true,
      "expected": "accepted",
      "media_type_exercised": "text/javascript1.3"
    },
    {
      "fixture_id": "media-text-javascript1-4",
      "request_path": "/m11.bin",
      "request_url": "http://127.0.0.1:8964/m11.bin",
      "request_id": "21",
      "response_status": 200,
      "response_content_type": "text/javascript1.4",
      "clause_matched": true,
      "expected": "accepted",
      "media_type_exercised": "text/javascript1.4"
    },
    {
      "fixture_id": "media-text-javascript1-5",
      "request_path": "/m12.bin",
      "request_url": "http://127.0.0.1:8964/m12.bin",
      "request_id": "22",
      "response_status": 200,